{
  "_notes": [
    "Compiled by Tom Collins, based on st_162h by HorsePin",
    "player_count added at 0x02110900, the one address shared across every Stern SAM game checked --",
    "24, X-Men, LUCI and both Star Trek revisions, over ten captures at one, two and four players.",
    "The declared score slots were confirmed on hardware rather than assumed: a 4-player game ending",
    "1,236,620 / 2,197,850 / 1,137,910 / 1,714,440 read back exactly at 0x02110A0C on a 4-byte stride.",
    "current_player and current_ball are still unmapped. Neither is retained in NVRAM after a game,",
    "and a sweep of 0x0-0x3FFFF did not produce the adjacent pair that identified them on X-Men and",
    "LUCI, so they are somewhere else in CPU RAM.",
    "current_player/current_ball came from the joint pair test -- the player wrapping to 1 in the same",
    "sample the ball steps up -- which returned exactly one hit across a full four-player game.",
    "Unlike trn_174h and twd_156c, this ROM resets both counters to 1 at game end, so its exit dump",
    "reads 1/1 rather than the 4/3 that confirmed those two. The single in-play hit is the evidence",
    "here; the dump neither confirms nor contradicts it.",
    "Scores verified against the same dump: 2,032,370 / 1,248,620 / 1,330,340 / 1,342,740 at 4-byte",
    "centres from 0x02110A0C, where stride 8 runs into the 0xFFFFFFFF fill. The sweep independently",
    "reproduced this map's existing score address, and rejected a CPU RAM candidate at 0x00038D9C",
    "whose four values (~16.7M, near-identical) are the usual scaled-set false positive."
  ],
  "_fileformat": 0.7,
  "_metadata": {
    "version": 6,
    "copyright": [
      "Copyright (C)2024 by Tom Collins <tom@tomlogic.com>",
      "Copyright (C) 2025 by Tom Collins <tom@scorbit.io>"
    ],
    "license": "Open Data Commons Open Database License (ODbL) v1.0",
    "platform": "stern-sam",
    "roms": [
      "st_162h",
      "st_162hc"
    ],
    "validation": {
      "checksum": [
        {
          "_notes": "119 adjustments: 4-byte LE value, 1-byte checksum, 3 bytes 0xFF padding",
          "repeat": {
            "count": 119,
            "step": 8
          },
          "label": "Adjustment {#} (checksum)",
          "start": "0x02102008",
          "length": 5,
          "complement": true
        },
        {
          "_notes": "65 audits: 4-byte LE value, 4 bytes observed always zero, 4-byte copy of the value, 1-byte checksum over those 12, 3 bytes 0xFF padding. The copy is written in the same instant as the value; a writer must update both and the checksum.",
          "repeat": {
            "count": 65,
            "step": 16
          },
          "label": "Audit {#} (checksum)",
          "start": "0x021023D0",
          "length": 13,
          "complement": true
        },
        {
          "_notes": "8 champion records: 28 bytes of initials and score, 2-byte LE checksum, 2 slack bytes",
          "label": "Champion record {#} (checksum)",
          "start": "0x02102ED0",
          "repeat": {
            "count": 8,
            "step": 32
          },
          "length": 30,
          "bits": 16,
          "complement": true
        }
      ],
      "mirror": [
        {
          "_notes": "65 audits: 4-byte LE value, 4 bytes observed always zero, 4-byte copy of the value, 1-byte checksum over those 12, 3 bytes 0xFF padding. The copy is written in the same instant as the value; a writer must update both and the checksum.",
          "repeat": {
            "count": 65,
            "step": 16
          },
          "start": "0x021023D0",
          "label": "Audit {#} (mirror)",
          "length": 4,
          "offsets": [
            0,
            8
          ]
        }
      ]
    }
  },
  "game_state": {
    "player_count": {
      "label": "Player Count",
      "encoding": "int",
      "start": "0x02110900"
    },
    "current_player": {
      "label": "Player",
      "encoding": "int",
      "start": "0x00034124"
    },
    "current_ball": {
      "label": "Ball",
      "encoding": "int",
      "start": "0x00034125"
    },
    "scores": [
      {
        "label": "Player 1",
        "encoding": "int",
        "length": 4,
        "start": "0x2110A0C"
      },
      {
        "label": "Player 2",
        "encoding": "int",
        "length": 4,
        "start": "0x2110A10"
      },
      {
        "label": "Player 3",
        "encoding": "int",
        "length": 4,
        "start": "0x2110A14"
      },
      {
        "label": "Player 4",
        "encoding": "int",
        "length": 4,
        "start": "0x2110A18"
      }
    ]
  },
  "high_scores": [
    {
      "label": "Grand Champion",
      "short_label": "GC",
      "initials": {
        "encoding": "ch",
        "null": "terminate",
        "length": 11,
        "start": "0x2102ED0"
      },
      "score": {
        "encoding": "int",
        "length": 4,
        "start": "0x2102EE8"
      }
    },
    {
      "label": "High Score #1",
      "short_label": "#1",
      "initials": {
        "encoding": "ch",
        "null": "terminate",
        "length": 11,
        "start": "0x2102EF0"
      },
      "score": {
        "encoding": "int",
        "length": 4,
        "start": "0x2102F08"
      }
    },
    {
      "label": "High Score #2",
      "short_label": "#2",
      "initials": {
        "encoding": "ch",
        "null": "terminate",
        "length": 11,
        "start": "0x2102F10"
      },
      "score": {
        "encoding": "int",
        "length": 4,
        "start": "0x2102F28"
      }
    },
    {
      "label": "High Score #3",
      "short_label": "#3",
      "initials": {
        "encoding": "ch",
        "null": "terminate",
        "length": 11,
        "start": "0x2102F30"
      },
      "score": {
        "encoding": "int",
        "length": 4,
        "start": "0x2102F48"
      }
    },
    {
      "label": "High Score #4",
      "short_label": "#4",
      "initials": {
        "encoding": "ch",
        "null": "terminate",
        "length": 11,
        "start": "0x2102F50"
      },
      "score": {
        "encoding": "int",
        "length": 4,
        "start": "0x2102F68"
      }
    }
  ],
  "mode_champions": [
    {
      "label": "Combo Champion",
      "initials": {
        "encoding": "ch",
        "null": "terminate",
        "length": 11,
        "start": "0x2102F70"
      },
      "score": {
        "encoding": "int",
        "length": 4,
        "start": "0x2102F88",
        "suffix": " Combos"
      }
    },
    {
      "label": "Warp Champion",
      "initials": {
        "encoding": "ch",
        "null": "terminate",
        "length": 11,
        "start": "0x2102F90"
      },
      "score": {
        "encoding": "int",
        "length": 4,
        "start": "0x2102FA8",
        "suffix": " Warps"
      }
    },
    {
      "label": "Medals Champion",
      "initials": {
        "encoding": "ch",
        "null": "terminate",
        "length": 11,
        "start": "0x2102FB0"
      },
      "score": {
        "encoding": "int",
        "length": 4,
        "start": "0x2102FC8",
        "suffix": " Medals"
      }
    }
  ],
  "checksum16": [
    {
      "start": "0x2102ED0",
      "length": 30,
      "label": "Grand Champion"
    },
    {
      "start": "0x2102EF0",
      "length": 30,
      "label": "High Score #1"
    },
    {
      "start": "0x2102F10",
      "length": 30,
      "label": "High Score #2"
    },
    {
      "start": "0x2102F30",
      "length": 30,
      "label": "High Score #3"
    },
    {
      "start": "0x2102F50",
      "length": 30,
      "label": "High Score #4"
    },
    {
      "start": "0x2102F70",
      "length": 30,
      "label": "Combo Champion"
    },
    {
      "start": "0x2102F90",
      "length": 30,
      "label": "Warp Champion"
    },
    {
      "start": "0x2102FB0",
      "length": 30,
      "label": "Medals Champion"
    }
  ]
}
